{
  "workspace": {
    "id": "partner-operations-v1",
    "type": "partner-operations",
    "version": 1,
    "displayName": "Partner Operations Workspace",
    "layout": "operational"
  },
  "zones": [
    { "key": "header", "component": "work_item_header", "placement": "top" },
    { "key": "queue", "component": "queue_view", "placement": "left" },
    { "key": "assistant_surface", "component": "assistant_surface", "placement": "left" },
    { "key": "artifact_surface", "component": "artifact_surface", "placement": "center" },
    { "key": "knowledge_panel", "component": "knowledge_panel", "placement": "right", "collapsible": true },
    { "key": "agent_panel", "component": "agent_panel", "placement": "right", "collapsible": true },
    { "key": "actions", "component": "action_panel", "placement": "right" }
  ],
  "bindings": [
    { "zone": "header", "objectKind": "work_item", "view": "partner_summary" },
    { "zone": "queue", "objectKind": "work_item", "view": "renewal_queue" },
    { "zone": "assistant_surface", "objectKind": "thread", "view": "assistant_thread" },
    { "zone": "artifact_surface", "objectKind": "artifact", "view": "renewal_analysis" },
    { "zone": "knowledge_panel", "objectKind": "knowledge_source", "view": "account_evidence" },
    { "zone": "agent_panel", "objectKind": "run", "view": "agent_runs" },
    { "zone": "actions", "objectKind": "action", "view": "recommended_actions" }
  ],
  "artifacts": [
    { "type": "renewal-analysis", "primary": true },
    { "type": "proposal-draft" }
  ],
  "actions": [
    { "type": "schedule-call" },
    { "type": "create-proposal" }
  ],
  "playbooks": [
    { "type": "renewal-review" }
  ],
  "policies": [],
  "permissions": []
}
