{
  "workspace": {
    "id": "decision-workspace-v1",
    "type": "decision",
    "version": 1,
    "displayName": "Decision Workspace",
    "layout": "review"
  },
  "zones": [
    { "key": "header", "component": "work_item_header", "placement": "top" },
    { "key": "queue", "component": "queue_view", "placement": "left" },
    { "key": "assistant_surface", "component": "assistant_surface", "placement": "left" },
    { "key": "artifact_surface", "component": "artifact_surface", "placement": "center" },
    { "key": "knowledge_panel", "component": "knowledge_panel", "placement": "right", "collapsible": true },
    { "key": "actions", "component": "action_panel", "placement": "right" }
  ],
  "bindings": [
    { "zone": "header", "objectKind": "work_item", "view": "decision_case_summary" },
    { "zone": "queue", "objectKind": "work_item", "view": "decision_queue" },
    { "zone": "assistant_surface", "objectKind": "thread", "view": "assistant_thread" },
    { "zone": "artifact_surface", "objectKind": "artifact", "view": "decision_report" },
    { "zone": "knowledge_panel", "objectKind": "knowledge_source", "view": "decision_evidence" },
    { "zone": "actions", "objectKind": "action", "view": "decision_actions" }
  ],
  "artifacts": [
    { "type": "decision-report", "primary": true }
  ],
  "actions": [
    { "type": "approve" },
    { "type": "request-revision" },
    { "type": "export" }
  ],
  "playbooks": [
    { "type": "decision-review" }
  ],
  "policies": [],
  "permissions": []
}
